iteration	timestamp	score	prev_best	status	knowledge_chars	provider	experiment	change_summary
1	2026-04-11T04:17:26+00:00	0.8000	0.0000	keep	22036	codex	baseline control-plane synthesis with planning UX and correctness	Built the first full knowledge base from the frozen source set, centering skeptical demand assessment, conversational SMART KR planning, explicit subagent protocol, permission governance, UI-first operator surfaces, and layered correctness and recovery.
2	2026-04-11T04:27:26+00:00	0.8200	0.8000	keep	32738	codex	evidence-density pass with source-level protocol and governance details	Kept the baseline structure and skeptical recommendation, but replaced generic support claims with direct mechanics from the frozen corpus: named Claude Code tools and code paths, Codex SDK and hook config surfaces, Multica daemon defaults and CLI surface, explicit object fields from the local protocol spec, and concrete recovery and testing invariants.
3	2026-04-11T04:35:25+00:00	0.7900	0.8200	discard	32396	codex	decision-first executive brief with appendices and denser benchmark citations	Added a sub-500-word executive decision brief that states what to build first, what to defer, and the top 3 risks; regrouped the rest of the draft as appendices instead of letting 17 sections compete equally; retained the stronger correctness cadence, concrete Claude Code permission component details, and richer source coverage in benchmark answers.
4	2026-04-11T04:52:36+00:00	0.8000	0.8200	discard	35857	codex	relevance-discipline pass with distinct decision brief and recovery metrics	Added a non-redundant Executive Decision Brief, kept the Working thesis as the reasoning chain, turned Recommendation into a concrete next-step action, retained Section 6's `completed_claimed` versus done and `EvidenceCheck` type detail, and absorbed the four-step Detect -> Contain -> Correct -> Learn recovery loop plus explicit operating metrics.
5	2026-04-11T04:58:02+00:00	0.8000	0.8200	discard	34408	codex	brief-led relevance discipline pass with metric-gated MVP recommendation	Integrated the discarded candidate's strongest deltas without keeping its repetition: added a sub-150-word Executive Decision Brief with forward references only, kept the tighter skeptical Working thesis opening, pruned duplicate restatement from Demand reality, What is technically feasible now, Why manage goals is still incomplete, and Recommendation, added the explicit primary operating metrics list, and converted Recommendation into phase-promotion criteria tied to those metrics while preserving spec-backed recovery rules.
6	2026-04-11T05:05:45+00:00	0.7900	0.8200	discard	37792	codex	worked-example planning UX with executive brief and metric-gated rollout	Kept the retained-best structure and skeptical stance, but added the strongest mergeable improvements with tighter relevance discipline: a short Executive Decision Brief with section cross-references, a concrete section 3 worked example that walks migrate auth middleware to OAuth2 from raw goal through clarifications, SMART KR gap repair, execution-readiness preview, and approval, and metric-gated phase-promotion criteria in section 17 tied to the testing strategy's operating metrics. I preserved the cleaner four-category error taxonomy and the stronger section 6 title/logic while avoiding a broad rewrite.
7	2026-04-11T05:26:20+00:00	0.8400	0.8200	keep	42666	codex	targeted pluggability-contract pass with OAuth2 planning walkthrough and rollout gates	Added a short Executive Decision Brief with section-level synthesis and metric-gated expansion criteria; inserted a concrete OAuth2 worked example into the conversational planning section to show clarifications, SMART gap repair, execution-readiness preview, and approval; and strengthened the pluggability section with a concrete TypeScript-level RuntimeAdapterPlugin contract covering schema refs, permission manifest, lifecycle activation/disposal, conflict rules, and idempotent cleanup.
8	2026-04-11T05:34:24+00:00	0.8100	0.8400	discard	44034	codex	relevance-discipline trim with second non-code planning walkthrough	Trimmed the Executive Decision Brief to the two non-redundant decisions that matter most, added a second worked planning example for non-code-heavy content migration to prove conversational SMART KR creation generalizes beyond software engineering, and kept the stronger OAuth2 walkthrough, plugin contract, and rollout-gate structure intact.
9	2026-04-11T05:39:49+00:00	0.8200	0.8400	discard	43553	codex	retain-best plus concise non-code planning generalization	"- Kept the retained-best structure and skepticism, including the explicit operator cockpit framing in the Executive Decision Brief.
- Preserved the design anchor sentence before the OAuth2 walkthrough and added a short content-migration mini-example that proves the planning flow generalizes beyond code-heavy work without repeating a full second KR set.
- Updated benchmark answers so the planning UX claim explicitly covers non-code-heavy work such as content migration while keeping every answer directly tied to cited sources."
10	2026-04-11T05:47:42+00:00	0.7700	0.8400	discard	25113	codex	relevance-discipline compression with proof-gap instrumentation	Cut the retained knowledge base from 42,666 chars to about 25,111 chars by merging repetitive sections, keeping one worked OAuth2 planning example, and consolidating architecture, governance, subagent, hook, pluggability, correctness, and recovery material into denser sections. Added one new decision-critical subsection on the missing proof the MVP must gather, naming the exact planning-friction and operating-economics metrics the pilot has to collect instead of repeating settled claims.
11	2026-04-11T05:53:11+00:00	0.8400	0.8400	keep	46260	codex	pluggability-generalization-pass-with-evaluator-provider-contract	Kept the retained-best knowledge base intact and made a narrowly targeted pluggability improvement. I preserved the concrete RuntimeAdapterPlugin contract, then added a second concrete EvaluatorProviderPlugin TypeScript contract with the same PermissionManifest, PluginManifest, lifecycle, and cleanup shape so the extension model now demonstrably generalizes across both execution and evaluation instead of stopping at runtime adapters.
12	2026-04-11T06:00:49+00:00	0.8000	0.8400	discard	22162	codex	integration-proof-pass-with-single-kr-walkthrough-and-relevance-trim	Kept the retained-best positions on architecture, pluggability, and correctness, then made one targeted relevance improvement: added a concrete end-to-end walkthrough of a single OAuth2 Key Result from conversational drafting through permission denial, replan, resume, verification, and operator acceptance. Tightened the decision framing so the remaining proof burden is scenario-level composition rather than more breadth.
13	2026-04-11T06:29:34+00:00	0.8900	0.8400	keep	42972	codex	relevance-discipline pass with integrated end-to-end KR proof	Kept the retained-best architecture, feasibility specifics, full runtime and evaluator plugin contracts, and dedicated risk section, then made a relevance-discipline pass. I replaced the generic executive architecture bullet with the sharper next-proof-burden call, compressed repetitive source-restatement in the hooks and subagent sections, and inserted a new 10-step end-to-end OAuth2 KR walkthrough between Recovery and Expansion Path to prove how the abstractions compose in practice.
14	2026-04-11T06:34:28+00:00	0.9000	0.8900	keep	33666	codex	relevance-discipline dedupe pass with section-referenced benchmark answers	Compressed repeated prose across the feasibility, subagent, hook, and pluggability sections; preserved the retained best's sharper executive framing, the explicit runtime object list, the explicit five-rule recovery section, and Section 15's end-to-end OAuth2 KR lifecycle; and rewrote the benchmark answers as terse section-referenced answers instead of restating the full argument.
15	2026-04-11T06:51:53+00:00	0.8900	0.9000	discard	38816	codex	relevance-discipline pass with restored goal-management boundary and concrete recovery anti-patterns	Kept the retained-best decision line, restored a dedicated section explaining why goal management alone collapses back into prompt babysitting without clarification, runtime routing, governance, evaluation, and replayable state, and added a concrete anti-pattern catalog to the recovery section with five named failure scenarios and exact protocol responses. I also preserved the fork-specific Claude Code detail about implicit fork triggering, inherited tool pool and thinking config, and byte-stable fork prefixes, while tightening the rest of the knowledge base into a denser decision-oriented draft.
16	2026-04-11T06:56:55+00:00	0.8000	0.9000	discard	29612	codex	relevance-discipline merge pass with concrete anti-pattern recovery and tighter section ownership	Preserved the retained-best structure and section numbering, folded the five concrete recovery anti-patterns into section 14, pulled the explicit why goal management alone is incomplete argument into section 6 so section 7 stays architectural, kept section 17s six-risk catalog, and tightened repetition by making the recommendation and benchmark answers point back to single authoritative sections instead of restating the whole case.
17	2026-04-11T07:03:48+00:00	0.8900	0.9000	discard	35799	codex	demand-reality stress test with operator-loop proof	Kept the retained best's clear feasible-versus-speculative split, richer section 11 hook outputs, categorized section 14 recovery model, and section-referenced benchmark answers. Added a targeted demand-reality stress test that uses the `auto-research` loop, Multica's daemon and board model, and Claude Code operator surfaces to answer the weakest claim directly: users can mostly manage goals only if the product compresses human work into plan approval, exception handling, and evidence acceptance rather than promising zero-touch autonomy.
18	2026-04-11T07:09:10+00:00	0.9000	0.9000	discard	34276	codex	relevance-discipline pass with auditable demand stress test and section ownership	Tightened relevance discipline by turning section 2 into an auditable A/B/C demand stress test with an explicit falsification rule and inference, making section 4 authoritative for SMART-KR planning while making section 15 authoritative for the OAuth2 execution lifecycle, renaming section 17s open question from demand risk to habit risk, and rewriting every benchmark answer as a direct self-contained response with non-empty citations.
19	2026-04-11T07:28:26+00:00	0.8800	0.9000	discard	34180	codex	relevance-discipline tightening pass with demand stress test, section-15 handoff, and prototype-next-step	Tightened overlap between the executive brief and demand section, renamed section 2 to Demand stress test, kept the sharper scope-narrowing phrase not more topic coverage, added the section 4 cross-reference that section 15 picks up the approved planning artifacts at governed launch, and made the recommendation more decision-oriented by naming the next concrete OAuth2 lifecycle prototype rather than adding new topical breadth.
20	2026-04-11T07:35:52+00:00	0.8000	0.9000	discard	12857	codex	plateau-aware relevance pass with prototype proof burden and self-contained benchmarks	Kept the retained-best conclusions but tightened relevance discipline. The knowledge base now states explicitly that source analysis has largely converged, compresses repeated scaffolding into a denser decision-oriented draft, and makes the next discriminating artifact one instrumented OAuth2 KR prototype. I also rewrote every benchmark answer as a direct self-contained answer with non-empty citations instead of section-pointer shorthand.
